Prato,Região,Descrição
Pizza,Nápoles,Um prato de massa achatada em forma redonda, coberta com molho de tomate e vários ingredientes, como queijo, presunto, cogumelos e azeitonas.
Lasanha,Emília-Romanha,Uma camada de massa intercalada com molho de tomate, carne moída, queijo e outros ingredientes, assada no forno.
Espaguete à Carbonara,Lácio,Espaguete com um molho feito de ovos, queijo, bacon e pimenta preta.
Risoto alla Milanese,Lombardia,Risoto de arroz com açafrão, manteiga e queijo parmesão.
Ravioli de Trufas,Piemonte,Ravioli recheado com trufas e queijo, servido com molho de manteiga e sálvia.
Osso Buco,Milão,Um prato de carne bovina cozida lentamente com cebola, cenoura, aipo, tomate, vinho e caldo, servido com polenta.
Focaccia,Ligúria,Um pão achatado coberto com azeite, sal grosso e várias coberturas, como azeitonas, cebola ou tomate.
Tiramisu,Vêneto,Uma sobremesa de camadas de biscoitos embebidos em café e creme de queijo mascarpone, polvilhado com cacau em pó.
